Company Name,Founded Year,Total Employees,Headquarters,Industry,Growth Potential,Risk Level,Key Strengths,Concerns,Target Market,Competitive Advantage,Interesting
SydneyData Solutions,2021,34,Sydney (Australia),Data Analytics,8,4,"Specialized focus on APAC region offering tailored solutions., Subscription model provides predictable and recurring revenue., Scalability due to SaaS model allowing easy expansion.","Intense competition from global data analytics firms., Potential geopolitical and regulatory challenges within the APAC region., Dependence on the continued economic growth of the region.",Businesses in the Asia-Pacific (APAC) region needing data analytics services.,"Optimization for the APAC region, potentially offering better localization and regulatory compliance in these markets than global competitors.",No
SmartFinance Technologies,2020,43,Chicago (USA),Financial Software,8,5,"Scalable subscription model adjusting based on company size and module selection, Comprehensive solutions covering financial management and planning, Potential integrations with existing enterprise systems, Strong relevance in growing financial digitalization trend","High competition in financial software industry, Potential market saturation due to many established players, Dependence on continued innovation to maintain competitive edge",Businesses of various sizes seeking scalable financial management solutions,Customizable subscription model that caters to specific financial needs and company sizes,Yes
BerlinCloud Group,2018,68,Berlin (Germany),Cloud Infrastructure,8,5,"European data sovereignty, GDPR compliance, Subscription-based model","High competition from global giants like AWS, Azure, and Google Cloud, Potential regulatory changes in data protection laws",European businesses requiring cloud infrastructure with data sovereignty and GDPR compliance,Focus on European data sovereignty and compliance with local regulations,No
AIProcess Solutions,2022,24,Boston (USA),Process Mining,7,5,"AI-driven recommendations enhance value proposition, Scalable subscription model, Targeting process optimization, critical for businesses seeking efficiency","Dependence on continuous technological advancement, Competition from established process management platforms, Potential for customer resistance if integration is complex",Mid to large enterprises seeking process optimization and efficiency improvements,"Utilizes AI to provide actionable recommendations, potentially offering more refined insights than traditional process mining solutions.",Yes
SingaporeLogic Systems,2020,45,Singapore,Business Rules Management,7,5,"Niche focus on ASEAN enterprises, Subscription model which provides predictable revenue, Customization based on rule complexity and execution volume","Limited to ASEAN region might limit scalability, Dependency on regulatory frameworks which might change and affect operations, Potential high competition from global players entering the market",ASEAN enterprises,Specialization in the ASEAN region's business needs and regulations,No
MobileSecure Technologies,2019,57,Toronto (Canada),Mobile Security,8,5,"Specialized in mobile security, a rapidly growing sector., Subscription-based model provides recurring revenue and potential for scalability., Ability to manage and secure devices, enhancing enterprise appeal.","Highly competitive industry with many established players., Dependence on continual technology updates to keep up with security threats., Potential regulatory challenges associated with data security laws globally.",Businesses and enterprises requiring secure mobile device management solutions.,"Comprehensive mobile security features combined with device management capabilities, appealing to businesses requiring robust, integrated solutions.",No
DigitalEdge Systems,2021,37,Austin (USA),Edge Computing,8,6,"Real-time analytics capabilities, Flexible node-based subscription model, Bandwidth tier options for scalability, Targeting a growing edge computing market","High competition from established tech giants in edge computing, Potential for rapid technological changes could outpace current capabilities, Dependence on network infrastructure for optimal performance","Businesses requiring fast, local data processing and analytics, particularly IoT, autonomous vehicles, and smart city applications.","Offering customizable, scalable edge solutions with real-time analytics tailored for specific bandwidth needs.",Yes
NordicSoft Solutions,2019,54,Oslo (Norway),Enterprise Software,7,4,"Tailored solutions for Nordic market, Strong focus on compliance with local business regulations, Established customer base with perpetual licensing model, Annual maintenance fees create a recurring revenue stream","Limited scalability due to region-specific focus, Perpetual licensing may result in lower long-term revenue compared to SaaS, Potential competition from SaaS models with flexible licensing options",Nordic enterprises seeking customized software solutions,"Deep understanding of cultural and regulatory requirements specific to Nordic businesses, allowing for highly tailored enterprise solutions.",No
CloudAI Technologies,2020,42,Seattle (USA),Artificial Intelligence,8,6,"Scalable platform capable of handling model training and inference for complex AI models, Subscription model based on compute resources, which can offer predictable revenue streams, Expertise in Artificial Intelligence with a focus on model efficiency and resource management","High competition within the AI and machine learning industry, which may affect market share, Dependency on rapidly evolving AI technologies necessitates constant innovation and adaptation, Potential high operational costs associated with maintaining cutting-edge compute resources","Businesses and enterprises seeking to leverage AI for various applications, including tech companies, research institutions, and businesses across different verticals needing AI-driven insights or automation.","CloudAI Technologies offers a highly scalable and versatile platform for AI model training and inference, supported by a subscription model that adjusts based on resource and complexity needs, enabling cost-effective solutions for businesses.",Yes
AsiaCommerce Group,2022,26,Singapore,E-commerce,8,5,"Local market optimization, Integrated storefront subscription and transaction fee model, Focus on fast-growing Southeast Asian markets","Intense competition from major international players, Logistical challenges in diverse markets, Dependence on internet penetration rates",Southeast Asian SMEs and local businesses,Tailored platform for regional needs and growth potential in underdeveloped e-commerce areas in Southeast Asia,No
HealthSync Technologies,2020,46,Boston (USA),Healthcare IT,8,4,"High demand for data interoperability in healthcare, Solution addresses compliance requirements such as HIPAA, Subscription model offers predictable revenue streams, Scalable platform with potential for wide implementation","Regulatory changes may impact operations, High level of competition in healthcare IT, Dependency on adoption by healthcare systems which can be slow","Healthcare providers, hospitals, clinics, and other entities within the healthcare ecosystem that require data interoperability solutions.","Uniquely positioned to facilitate seamless data integration across diverse healthcare systems, ensuring compliance and improved patient outcomes.",Yes
TelAvivSoftware Systems,2018,63,Tel Aviv (Israel),Cybersecurity,8,6,"Comprehensive threat intelligence platform, License-based model with stable revenue, Strong industry demand due to increasing cyber threats","Highly competitive market, Dependence on continuous innovation to stay ahead, Regulatory changes impacting cybersecurity models",Enterprises seeking threat intelligence solutions,Combination of superior threat intelligence feeds and a flexible license-based model making it attractive for sustained enterprise security needs.,No
DataPipeline Solutions,2021,32,Denver (USA),Data Integration,8,4,"Pre-built connectors reduce integration time, Scalable subscription model based on data volume and complexity, Comprehensive ETL capabilities, Strong focus on enterprise customers","High competition from established players like Informatica, Talend, and MuleSoft, Reliance on partner ecosystems for connector updates, Data security and compliance challenges",Large enterprises and organizations with complex data integration needs,"Offers a flexible, subscription-based pricing model tailored to clients' data volume and complexity, coupled with comprehensive pre-built connectors that accelerate integration timelines.",Yes
LondonLogic Technologies,2020,44,London (UK),Business Rules Management,7,5,"Scalable pricing model based on rule complexity and execution volume, Focus on compliance provides leverage in highly regulated industries, Subscription model offers potential for steady revenue streams","Market competition from established players in business rules management, Dependency on regulatory changes which may affect compliance features demand, Potential complexity in scaling operations to handle high execution volumes","Enterprises in regulated industries such as finance, healthcare, and insurance seeking efficient business rules management solutions","LondonLogic Technologies' compliance-focused features cater to industries with strict regulatory requirements, providing tailored solutions that ensure compliance while managing business rules effectively.",No
QuantumEdge Networks,2019,58,Vancouver (Canada),Network Optimization,8,6,"Innovative approach using quantum-inspired algorithms, Scalable subscription model based on network size, Potential for significant cost savings and efficiency improvements for customers","Dependence on cutting-edge technology that may have limited understanding and adoption, Competitive pressure from established network optimization companies, Regulatory hurdles related to data handling and quantum technology",Large enterprises and telecommunication companies seeking to optimize network performance and reduce costs,Quantum-inspired algorithms that potentially offer superior optimization capabilities compared to traditional methods.,No
JapanTech Innovations,2022,25,Tokyo (Japan),Translation Services,8,6,"AI optimization for Asian languages, Scalable subscription model, Focused niche within translation services","High competition from established players in the translation industry, Dependence on AI accuracy and updates, Cultural nuances may be challenging to fully capture","Businesses and professionals needing accurate Asian language translations, with a focus on industries like tourism, e-commerce, and international business.","Specialization in Asian languages which are often less prioritized by major translation services, offering more accurate and local-market tailored solutions.",No
SecureData Systems,2020,43,Washington DC (USA),Data Security,8,5,"Subscription-based revenue model provides predictable income, Focus on compliance modules aligns with increasing regulatory demands, Scalable pricing based on data volume caters to businesses of all sizes, Strong industry demand for data security solutions","Highly competitive market with several established players, Dependence on timely updates to comply with evolving regulatory standards, Emerging threats in cybersecurity require continuous innovation",Businesses across various industries with a need for data security and regulatory compliance,"Modular platform offering both data security and compliance management, enabling flexibility for different industries and regulatory requirements.",Yes
BerlinAI Solutions,2019,56,Berlin (Germany),Artificial Intelligence,8,6,"Subscription-based model provides predictable revenue streams, Focus on machine learning operations addresses critical needs in AI deployment, Target market of European enterprises gives access to a large and potentially growing market, Scalable pricing based on model count and compute resources","Highly competitive market with numerous well-funded competitors, Dependence on continuous innovation to stay ahead of competitors, Potential regulatory challenges within different European countries",European enterprises deploying AI solutions,Tailored operations platform that enhances AI deployment efficiency for European enterprises,No
CloudOps Technologies,2021,35,San Francisco (USA),Cloud Management,85,70,"Automates cloud operations efficiently, Utilizes AIOps for enhanced incident management, Scalable subscription model","Competitive cloud management market, Reliance on AI models, which may face biases, Regulatory compliance challenges in different regions",Large enterprises and mid-sized companies using cloud infrastructure that need efficient management and incident resolution.,"AIOps capabilities that enhance operational efficiencies and automated incident resolution, reducing downtime and costs.",No
SydneyTech Group,2020,47,Sydney (Australia),Cloud Infrastructure,8,6,"Optimized for Oceania region, Local data residency compliance, Subscription-based model","Regional focus may limit market size, Competition from global cloud providers, Data sovereignty laws may impact flexibility",Businesses in Oceania requiring localized cloud services,Specialization in local data residency and optimized services for the Oceania region,No
FinanceTech Solutions,2018,62,New York (USA),Financial Software,8,5,"Scalable subscription model, Customizable modules based on company needs, Strong focus on financial planning and analysis","Highly competitive fintech landscape, Regulatory compliance challenges, Dependence on subscription renewals for revenue stability",Medium to large enterprises seeking robust financial planning solutions,Customizable and scalable platform tailored to various company sizes and needs,No
MadridSoft Technologies,2022,24,Madrid (Spain),Business Management,80,60,"Specialized focus on Spanish-speaking markets, which are often underserved in business management software, Subscription-based model allows for predictable and recurring revenue, Localization features increase product adoption and stickiness among diverse Spanish-speaking regions","The business management software market is highly competitive with dominant global players, which may limit market share, Dependency on Spanish-speaking regions may inhibit growth outside of these markets, Economic fluctuations in key Spanish-speaking countries could impact customer base and revenue",Spanish-speaking businesses seeking localized business management software solutions,"Strong focus on localization for Spanish-speaking markets, offering tailored features that suit local business needs better than generic global solutions.",No
DevSecOps Technologies,2020,44,Toronto (Canada),DevOps,8,6,"Unique focus on security within DevOps, Subscription pricing model allows for predictable revenue, Compliance automation addresses a growing need for secure software deployment","High competition in both DevOps and security sectors, Reliance on maintaining constant innovation to stay ahead of competitors",Mid to large software development companies valuing security and compliance,"Integration of security and compliance automation directly into DevOps processes, reducing the need for multiple disparate tools",Yes
SingaporeAnalytics Systems,2019,55,Singapore,Business Intelligence,8,6,"Focus on ASEAN markets, which are rapidly growing and digitally transforming, Subscription-based model offers predictable revenue streams, Strong customization due to vast range of data sources and dashboard users","Intense competition from global and regional BI platforms, Dependence on the growth of digital transformation initiatives in ASEAN markets, Potential challenges with data integration from various sources",Small to medium enterprises and corporations within the ASEAN region seeking to leverage data for informed decision-making,Localized expertise and market-tailored solutions for ASEAN businesses,No
SmartProcess Solutions,2021,33,Chicago (USA),Process Automation,8,5,"AI-driven optimization, Scalable subscription model, Focus on process complexity and execution volume","Competition from established automation platforms, Dependency on AI technology advancements, Customer acquisition cost in a competitive market",Medium-to-large enterprises in need of process automation,AI-driven process optimization tailored to specific process complexity and execution volume,Yes
StockholmTech Innovations,2020,45,Stockholm (Sweden),Enterprise Software,7,5,"Region-specific compliance features, Subscription scalability based on user count and modules, Focus on Nordic markets","Limited market reach being focused on Nordic regions, Potential competition from global enterprise software providers",Nordic enterprise businesses requiring regional compliance,Tailored software solutions with regional compliance enhancements for the Nordic market,No
CloudMatrix Technologies,2018,65,Seattle (USA),Cloud Management,8,5,"Offers multi-cloud management solutions which caters to a broad set of client needs., Cost optimization capabilities that can offer significant savings for clients., Percentage-of-savings fee model aligns company interests with customer success., Recurring revenue through base subscription model provides financial stability.","Highly competitive market with numerous established players., Dependence on cloud vendor relationships and APIs could pose a risk., Need for continuous innovation to stay ahead in the technology curve., Economic downturns may impact clients' IT budgets and spending on cloud optimization tools.","Businesses seeking efficient management and cost optimization across multiple cloud platforms, particularly mid-sized enterprises and larger organizations with complex cloud infrastructures.","CloudMatrix Technologies offers a flexible pricing model that aligns costs with customer's recognized savings, incentivizing customer satisfaction and retention, along with streamlined cross-platform cloud management capabilities.",No
MobileTech Systems,2022,27,Boston (USA),Mobile Security,8,4,"Subscription-based revenue model provides consistent cash flow, Increasing importance of mobile security and device management, Strong demand from enterprises for security solutions due to rising cyber threats, Ability to integrate with various mobile operating systems and devices","Highly competitive market with numerous competitors, Need for constant innovation to keep up with evolving security threats, Potential challenges in scaling efficiently as device numbers grow, Dependence on operating system manufacturers for compatibility","Enterprises and organizations with a high number of mobile device deployments, particularly those prioritizing security and compliance",Multi-layered security features and comprehensive device management capabilities tailored for enterprises looking to secure their mobile infrastructure.,Yes
DublinSoft Solutions,2020,42,Dublin (Ireland),Fintech,8,5,"Niche focus on European markets, which have specific regulatory requirements, Subscription model aligns with client needs based on transaction volume and modular regulatory requirements, Strong demand due to stringent financial compliance needs in Europe, Potential for scalability across additional geographic markets within Europe","Potential regulatory changes could impact the business model, High dependency on specific European regulatory frameworks which might limit adaptability, Competition from larger, established financial compliance platforms with broader service offerings",Financial institutions and corporations operating in European markets requiring compliance with financial regulations,"Specialized platform that offers modular compliance solutions tailored to European financial regulatory requirements, allowing for flexible and scalable compliance management.",No
AutomationFlow Technologies,2019,57,Minneapolis (USA),Process Automation,8,6,"Advanced AI capabilities integrated with RPA, Innovative bot-based licensing model, Flexibility with designer seat licenses, Growing market demand for process automation, Strong focus on reducing time and costs for businesses","Competitive process automation market with established giants, Potential cybersecurity risks inherent in AI and RPA solutions, Need for continuous technology updates and innovation to maintain competitive edge, Possible high initial setup costs for potential customers","Large enterprises and mid-sized companies seeking efficiency in their business processes across various industries such as banking, insurance, retail, and manufacturing.",Combination of AI and RPA providing a scalable and efficient process automation platform with a flexible licensing model that offers cost-effective customization for businesses.,No
TokyoData Systems,2021,31,Tokyo (Japan),Data Analytics,8,6,"Specialization in Japanese enterprise market, Subscription-based model provides predictable revenue, Optimized visualization capabilities tailored to local needs","Limited market scope due to geographic focus, Potential competition from global data analytics platforms expanding into Japan",Japanese enterprises requiring customized data analytics solutions,Culturally and regionally optimized data analytics solutions.,No
QuantumSoft Technologies,2020,48,San Diego (USA),Quantum Computing,8,7,"Innovative quantum algorithms optimize complex logistics tasks, Subscription model allows scalable revenue based on problem complexity","Quantum computing industry is still nascent and has high technical risks, High dependency on technological advancements and acceptance",Logistics and supply chain companies needing optimization of complex systems,Unique focus on quantum-inspired algorithms provides potentially superior optimization capabilities compared to classical algorithms,No
MunichTech Systems,2018,61,Munich (Germany),Industrial IoT,8,5,"Recurring revenue model through subscription services, Integration of both hardware sensors and analytics gives a comprehensive solution, Focus on industrial IoT caters to the growing need for smart manufacturing solutions, High demand for data-driven decisions in manufacturing increases relevance","Dependent on ongoing trends in IoT security and data privacy, Requires continuous innovation to stay ahead of competitors in technology, Reliant on manufacturing industry's economic cycles and capital expenditure plans","Manufacturers looking to optimize processes, enhance productivity, and leverage data analytics for operational improvements.","Integrated platform combining hardware and analytics, allowing seamless data collection and insights generation for manufacturers.",No
CloudHealth Solutions,2022,25,Chicago (USA),Healthcare IT,8,3,"Scalable subscription model based on patient volume, Strong emphasis on compliance, crucial for healthcare industry, Comprehensive analytics modules tailored for healthcare","High dependency on healthcare regulations which can change rapidly, Potential data privacy issues due to handling sensitive patient data","Hospitals, clinics, and health systems looking to enhance data-driven decision making and ensure compliance.","Integration of compliance features with analytics provides a dual value proposition, addressing both operational insight and regulatory needs.",Yes
AustralianTech Group,2020,46,Melbourne (Australia),Cloud Infrastructure,8,6,"Local data residency in Oceania, catering to regional data sovereignty laws, Subscription-based model providing predictable revenue streams, Focused on optimizing services for the specific needs of the Oceania region","High competition from global cloud providers like AWS, Azure, and Google Cloud, Potential limitations in scalability compared to global competitors, Regulatory changes in data residency laws could impact operational flexibility",Businesses and government entities in the Oceania region requiring locally compliant cloud services.,"Customized cloud infrastructure solutions optimized for the specific regulatory and business needs of the Oceania region, leveraging local data residency as a core feature.",No
DataVision Technologies,2019,53,Austin (USA),Data Visualization,8,6,"Scalable subscription model, Strong emphasis on user-friendly interfaces, Highly customizable dashboards, Integration capabilities with multiple data sources","Competitive industry with established players, Highly dependent on the effectiveness of data security measures, Potential high customer acquisition costs",Businesses and enterprises looking to harness data for strategic decision making,Customization and scalability of data visualization solutions tailored to specific industry needs,No
TelAvivAI Systems,2021,34,Tel Aviv (Israel),Cybersecurity,8,6,"AI expertise in cybersecurity, Scalable subscription model, Focus on proactive threat detection","High competition from established cybersecurity firms, Potential risks with AI false positives, Dependency on continuous technological advancement",Enterprises with significant network infrastructure and high-security demands,Advanced AI algorithms offering proactive threat detection rather than reactive security measures.,No
SmartFinance Solutions,2020,45,Toronto (Canada),Financial Software,7,5,"Scalable platform catering to multiple company sizes, Modular subscription enables customized solutions, Strong demand for financial management solutions, Recurring revenue model","Highly competitive market with many incumbents, Potential customer churn if not adequately addressed, Rapid technological advancements requiring continuous updates",Businesses of varying sizes requiring financial management and reporting solutions,Customizable modules and scalable subscription plan allow tailored and flexible solutions for diverse business needs.,Yes
