Company Name,Founded Year,Total Employees,Headquarters,Industry,Growth Potential,Risk Level,Key Strengths,Concerns,Target Market,Competitive Advantage,Interesting
CloudLogic Labs,2021,38,Boston (USA),Software,8,6,"Integrated resource allocation enhances functionality, Subscription-based pricing provides predictable revenue, High demand for project management tools","Highly competitive market with many established players, Risk of market saturation, Dependence on continuous technological updates",Businesses seeking efficient project management solutions with resource allocation capabilities,"Comprehensive platform that integrates project management with resource allocation, potentially reducing tool sprawl for users.",Yes
DataSync Technologies,2020,42,San Francisco (USA),Data Integration,85,65,"Real-time data synchronization capability, Flexible pricing model with subscription and volume-based pricing, Strong demand in enterprise markets for data integration solutions","Highly competitive market with many established players, Potential scalability issues as data volumes grow, Dependence on continuous innovation to maintain technological edge",Large enterprises with complex IT infrastructures requiring real-time data integration between systems.,Real-time data synchronization features that enhance operational efficiency and decision-making processes across multiple enterprise systems.,No
SecureEdge Solutions,2022,27,Austin (USA),Cybersecurity,8,4,"Zero-trust security approach, Centralized policy management, Per-user monthly billing model","High competition in the cybersecurity industry, Dependence on continuous tech innovation to stay relevant, Potential difficulty in scaling operations with large enterprise clients","Organizations with distributed workforces, including SMEs and large enterprises seeking robust security solutions.","Offering a zero-trust framework with a flexible, per-user billing model, allowing cost scalability and adaptability to client needs.",Yes
NexusWave Systems,2019,52,Toronto (Canada),Software Development,8,4,"Cross-platform deployment, Annual licensing model ensuring recurring revenue, Comprehensive implementation services","Potential competition from larger, established software development platforms, Dependence on continual technological advancement to stay competitive",Businesses and developers seeking efficient application development tools across multiple platforms,"An integrated environment that simplifies cross-platform deployment, reducing time and resources for development teams.",No
QuantumAI Corp,2021,34,Seattle (USA),Artificial Intelligence,8,6,"Proprietary algorithm optimization software., Unique AI hardware accelerators., High entry barrier for competitors.","High dependency on one-time sales rather than recurring revenue., Potentially high R&D costs associated with maintaining technology leadership., Competition from larger tech companies investing in similar technologies.","Enterprises requiring cutting-edge AI hardware solutions, such as data centers, research institutes, and companies focused on machine learning applications.","Combining both hardware and software expertise in AI, offering an integrated solution that is difficult for competitors to replicate.",No
RapidCore Software,2020,45,New York (USA),DevOps,8,5,"Strong focus on automation streamlines DevOps processes., CI/CD capabilities address a crucial need for modern software development., Team-based subscription model encourages collaborative work environments., Unlimited repositories offer flexibility and scalability to users.","Competitive industry with major players like Jenkins, GitLab, and CircleCI., Dependence on cloud infrastructure may pose reliability challenges., Potential churn if not consistently improving or staying competitive with features.","Software development teams looking for efficient, automated DevOps solutions.",The unlimited repositories and team-based subscription model could attract small to medium-sized enterprises looking for cost-effective and scalable DevOps solutions without repository limitations.,Yes
SmartLogistics Tech,2018,67,Chicago (USA),Logistics,8,6,"IoT-enabled real-time tracking capability, Hybrid model of hardware and software, Recurring revenue from software fees, Increased efficiency in logistics operations","Hardware reliability and replacement costs, Competition from established logistics companies, Data privacy and security issues",Large-scale logistics and supply chain companies,Combination of IoT hardware and software solution that offers comprehensive real-time supply chain tracking and optimization.,No
MacroAnalytics Group,2021,32,San Diego (USA),Finance,7,5,"Niche focus on mid-market companies, Subscription-based model providing recurring revenue, Role-based access control ensuring data security and compliance, Specialized financial reporting tools","Highly competitive market with many established players, Dependence on subscription renewals for revenue stability, Potential regulatory changes impacting service offerings",Mid-market companies needing enhanced financial analysis and reporting,"Specialization in mid-market enterprise solutions with secure, role-based access control to meet specific financial analysis and reporting needs.",Yes
HyperBlock Systems,2020,58,Vancouver (Canada),Blockchain,8,6,"Specialized in blockchain document verification, Recurring revenue model through transaction fees, Custom implementation services that can cater to specific client needs","Regulatory risks associated with blockchain technologies, High competition in the blockchain space, Technological challenges in maintaining blockchain security","Financial institutions, legal sector, and enterprises needing secure document verification",HyperBlock Systems' ability to offer custom implementation services alongside standard blockchain document verification services gives it a more tailored approach compared to competitors.,Yes
UltraConnect Networks,2019,49,Denver (USA),Telecommunications,8,4,"Scalable pricing model with predictable revenue stream, Catered to enterprises which ensures larger contracts and higher revenue per customer, Unlimited usage offering simplifies customer decision-making, Unified platform potentially reduces need for multiple communication tools","High competition in the telecommunications and unified communications space, Dependence on enterprise clients requires strong sales and account management, Potential for pricing pressure from larger competitors offering bundled services, Technology advancements could require continuous reinvestment",Large enterprises and corporations seeking integrated communication solutions,Comprehensive unified communications platform offering unlimited usage at a competitive per-seat price.,No
AgileStack Technologies,2022,22,Austin (USA),Cloud Infrastructure,8,6,"Scalable usage-based pricing model, Strong presence in the microservices orchestration niche, Developer-friendly approach with API management solutions","High competition in cloud infrastructure and microservices sector, Need to continually innovate to stay ahead, Dependence on developer adoption and retention",Developers and enterprises looking for microservices orchestration solutions,Specialized focus on microservices orchestration with a flexible pricing model,Yes
VertexFlow Solutions,2021,36,Seattle (USA),Business Process Management,8,6,"No-code platform lowers barriers to entry for businesses to automate workflows., Tiered subscription model allows for scalability in revenue., Web-based tool facilitates easy access and integration with existing business processes.","Market may be saturated with similar products from established players., Dependence on web browser may limit functionality if not optimized for different environments., Workflow limits in subscription may deter large enterprises from full adoption.",Small to Medium-sized Enterprises (SMEs) and departments within larger organizations looking for easy automation solutions.,"Simple, user-friendly no-code interface that makes workflow automation accessible to non-technical users.",Yes
BrightPath Analytics,2020,43,Toronto (Canada),Marketing Analytics,8,3,"Comprehensive customer journey analytics, Heat-mapping capability, Conversion tracking effectiveness, Flexible pricing model with data volume tiers","Competitive market with many established players, Dependence on technological advancements in analytics and data processing, Potential issues with data privacy and security",Enterprises and mid-size companies seeking to optimize their marketing strategies and customer experience,"Combining comprehensive analytics with heat-mapping and conversion tracking in a scalable SaaS model, allowing businesses to understand and optimize the customer journey effectively.",Yes
MetaHub Networks,2018,71,San Francisco (USA),Network Security,8,6,"Combination of hardware and cloud services offers flexibility, Recurring revenue model through security subscriptions, Growing market demand for network security solutions, Strong focus on cloud management, aligning with cloud adoption trends","Highly competitive market with established players, Dependence on continual security updates and subscriptions for revenue, Potential technological obsolescence, Need for constant innovation to stay ahead of emerging security threats",Businesses seeking comprehensive network security solutions with cloud management capabilities,Hybrid model of hardware and cloud-based management providing scalable and efficient security solutions,No
EpsilonData Systems,2022,25,Boston (USA),Data Governance,7,5,"Industry-specific compliance packages, Annual subscription model, Web portal accessibility, Focus on compliance management","Potential competition from larger firms with more resources, Need for continuous updates due to changing regulations, Dependence on subscription renewals for revenue stability","Regulated industries requiring strict data governance and compliance management, such as healthcare, finance, and government sectors.","Offers specialized industry-specific compliance solutions with an easy-to-navigate web portal, providing ongoing updates and support through a subscription model.",Yes
AlphaEdge Computing,2019,54,Washington DC (USA),Cloud Infrastructure,85,65,"Edge computing expertise, Scalable and distributed data centers, Usage-based billing model, Reserved capacity for enterprise clients","Intense competition from large cloud providers, High infrastructure costs, Reliance on emerging technology adoption",Enterprises requiring real-time data processing and low-latency services,"AlphaEdge Computing's competitive advantage lies in its specialized edge computing infrastructure with distributed data centers that allow for faster processing and lower latency, along with a flexible billing model that caters to a wide range of client needs.",No
OmniSphere Technologies,2021,39,Chicago (USA),Customer Experience,8,5,"Omnichannel integration capability, Subscription-based model with unlimited user access, Focus on enhancing customer experience management","Highly competitive market, Reliance on continuous technological advancements, Potential scalability challenges",Businesses seeking enhanced customer experience management across multiple channels,"OmniSphere's competitive advantage lies in its seamless integration of omnichannel communication, allowing businesses to manage customer interactions more effectively through a unified platform.",Yes
PulseTech Solutions,2020,47,Austin (USA),Sales Software,8,4,"Seamless CRM Integrations, Per-User Pricing Model, Focus on Revenue Operations","High Competition in Sales Software Industry, Need for Continuous Innovation to Stay Ahead",Sales Teams and Revenue Operations Departments in Medium to Large Enterprises,Specialized focus on revenue operations and enabling seamless CRM integrations,Yes
FusionLink Services,2019,59,Washington DC (USA),Enterprise Integration,8,4,"Connector-based subscription model, Expertise in enterprise systems integration, Scalable platform for diverse industries, Strong focus on secure data exchange","Highly competitive market with established players like MuleSoft and Dell Boomi, Dependence on ongoing updates to maintain compatibility with a wide variety of systems, Need for significant R&D investment to keep up with rapid technological changes",Large enterprises requiring integration of complex and multifaceted IT environments,Flexible and scalable integration solutions with a straightforward subscription model facilitating cost predictability.,No
DeltaHub Applications,2022,24,Toronto (Canada),App Development,8,5,"No-code platform attracts non-technical users., Monthly subscription model provides recurring revenue., No need for technical skills expands potential user base.","High competition in the no-code app development space., Potential limitations in functionality compared to custom-coded apps.",Small to medium-sized businesses and individual entrepreneurs looking for cost-effective mobile app solutions without technical expertise.,User-friendly no-code interface allowing rapid development and deployment of mobile applications.,Yes
StreamLogic Networks,2020,48,New York (USA),Data Processing,8,6,"Real-time data processing capabilities, Flexible, data volume-based pricing model, Scalable cloud infrastructure, Strong focus on event processing","Competitive market with major players like AWS Kinesis, Apache Kafka, and Google Dataflow, Dependence on continual technological advancement to maintain a competitive edge, Potential privacy and security issues related to data handling if not properly managed, Variable customer expenditure due to volume-based pricing may lead to unpredictable revenues","Enterprise businesses requiring real-time data processing and analytics, particularly in sectors like finance, e-commerce, and telecommunications.","StreamLogic Networks differentiates itself with its real-time, event-specific processing capabilities coupled with a flexible data volume-based pricing model, providing cost-effective solutions tailored to client needs.",Yes
SigmaCore Technologies,2019,56,Chicago (USA),Business Intelligence,7,4,"Automated reporting reducing manual workload, Tiered subscription model appealing to diverse business sizes, Potential for high recurring revenue due to subscription model","Highly competitive market with established players, Dependence on constant innovation to stay ahead, Scalability challenges as user base grows",Small to medium enterprises looking for efficient and cost-effective BI solutions,Fully automated reporting and customizable dashboard options that cater to different business sizes and needs.,No
OmegaSync Software,2021,31,San Francisco (USA),Collaboration,8,5,"Offers essential tools for file synchronization, relevant in an increasingly remote work environment, Subscription-based model provides recurring revenue, Storage tier options cater to various customer needs and budgets","Highly competitive market with established players like Dropbox, Google Drive, etc., Dependency on a subscription model could be impacted by economic downturns impacting team budgets, Need for constant updates and improvements to remain competitive","Businesses and collaborative teams needing reliable file synchronization and storage solutions, with a focus on SMBs and enterprises.",Personalized and potentially more customizable solutions for businesses compared to generic cloud storage services.,Yes
ClearView Analytics,2020,44,Boston (USA),Marketing Analytics,8,4,"Subscription-based revenue model providing predictable income, Strong demand for data-driven marketing solutions, Capability for data retention offering flexibility to customers","Highly competitive marketing analytics space with numerous established players, Reliance on data privacy regulations could affect platform adaptability, Need for continuous technological advancement to stay relevant",Medium to large enterprises seeking advanced marketing attribution and analytics solutions,Unique data retention options that provide flexibility in data management and potentially lower costs for clients.,Yes
CoreCloud Services,2018,73,Seattle (USA),Cloud Management,8,4,"Scalable pricing model based on server count tiers, allowing flexibility for various sizes of businesses, Focus on optimization and monitoring which is crucial for cost savings and efficiency in cloud management, Ability to integrate with multiple cloud service providers","Potential competition from established cloud infrastructure developers or cloud service providers themselves offering similar tools, Dependence on server count as a pricing metric might narrow market reach if enterprises look for more comprehensive pricing models, Need for continuous innovation to keep up with rapid advancements in cloud technology",Enterprises using cloud services and seeking to optimize their cloud infrastructure management and reduce operational costs.,"Unique agent-based pricing model that offers scalability and flexibility, and the focus on direct optimization and cost efficiency for businesses using cloud infrastructure.",No
ThetaTech Solutions,2022,23,Austin (USA),Identity Management,8,6,"Recurring revenue model through per-user monthly billing, Integrated SSO features enhancing user experience and integration, Strong demand for identity management solutions in the digital age, Focus on security and password management addressing critical market needs","Highly competitive market with several established players, Dependency on market adoption of SSO and IAM due to shifting tech trends, Potential regulatory challenges in identity management industry",Mid to large enterprises seeking secure and efficient identity management solutions,"ThetaTech Solutions offers a comprehensive IAM solution with integrated SSO features, coupled with a flexible SaaS-based pricing model that adds value and accessibility to a wide range of enterprises.",Yes
WebLogic Platforms,2020,46,Denver (USA),Content Management,7,5,"Headless API capabilities offering flexibility, Pricing model based on content types and API calls for scalability, Strong positioning in the growing content management industry","High competition with established CMS providers, Dependency on API performance and reliability, Need for continuous feature innovation to remain competitive","Businesses requiring customized content management solutions, digital agencies, developers, and companies transitioning to omnichannel content strategies",Flexible pricing model and headless API capabilities that allow for seamless integration with various frontend technologies and tailored content delivery solutions.,Yes
IoT Nexus Corp,2019,51,Minneapolis (USA),Internet of Things,8,6,"Comprehensive IoT device management integrating hardware and software, Recurring revenue model through platform subscription, Ability to gather data insights from deployed IoT sensors, High demand for IoT solutions across industries","Dependence on hardware sales which might have lower margins, Potential security issues related to IoT devices, High competition from established tech companies in the IoT space","Businesses implementing IoT solutions across various sectors such as manufacturing, healthcare, smart cities, and agriculture","Integrated solution offering both hardware and software for seamless IoT management, along with a strong subscription-based revenue model that provides continuous income and customer engagement.",No
MobileFlex Technologies,2021,37,San Diego (USA),Mobile Device Management,8,5,"Scalable per-device billing model, Enterprise focus with potential for large contracts, Increased demand for mobile device management due to remote work trends","Highly competitive market with established players, Dependent on IT budgets of enterprises, which can be volatile, Security breaches can directly impact business reputation",Medium to large enterprises with significant numbers of mobile devices,Flexible pricing model per device and strong focus on enterprise-specific needs.,Yes
BlockChain Solutions,2020,55,Vancouver (Canada),Blockchain,8,6,"Rising adoption of cryptocurrency offers a significant market for payment solutions., Recurring revenue model through transaction fees and monthly minimum., Potential network effects as more businesses adopt the platform.","Regulatory risks associated with cryptocurrency markets., High competition from established payment processors and new blockchain-based solutions., Volatility in cryptocurrency values can affect transaction volume and revenue stability.",Businesses and merchants looking to integrate cryptocurrency payment solutions.,Specialization in cryptocurrency transactions allows for tailored solutions that traditional payment processors may lack.,Yes
GreenTech Systems,2018,62,Portland (USA),Sustainability,8,5,"Increased focus on environmental sustainability by businesses and regulations, Integration with companies' existing sustainability goals, Scalable subscription model based on company size tiers","Potential saturation of market with similar solutions, Market dependency on regulatory requirements, Company's ability to continuously innovate and provide value beyond competitors",Mid to large-sized enterprises committed to sustainability and environmental impact reduction,"Provides detailed carbon footprint tracking bundled with comprehensive sustainability reporting tailored to company size, meeting regulatory compliance needs efficiently.",No
CloudOps Technologies,2022,26,Seattle (USA),Cloud Management,8,5,"Intelligent scaling capabilities optimize resource allocation, reducing costs and increasing efficiency for clients., Usage-based pricing model is attractive to businesses needing cost predictability and alignment with resource utilization., Automation of cloud management on infrastructure streamlines operations and reduces manual overhead.","Market is highly competitive with major established players like AWS, Azure, and Google Cloud Platform offering similar services., Potential dependency on continuous technological advancements to maintain competitive edge in automation and scaling., Pricing strategy must be carefully managed to avoid margin squeeze due to competitive pricing pressures.",Medium to large enterprises seeking efficient and scalable cloud infrastructure solutions.,"Differentiated by its intelligent scaling and usage-based pricing, offering cost-efficiency and flexibility.",Yes
DataVault Security,2020,41,Washington DC (USA),Data Security,8,5,"Comprehensive data encryption and security offerings., Flexible subscription model based on data volume and retention., Ability to cater to businesses of all sizes due to scalable solutions., Strong market demand for data security solutions amid increasing cyber threats.","Highly competitive industry with many established players., Dependence on technological advancements to stay current., Potential regulatory challenges in regions with strict data privacy laws.","Businesses seeking secure data storage and encryption solutions, including SMEs to large enterprises in sectors like finance, healthcare, and e-commerce.","Scalable and flexible pricing model tailored to client needs, addressing both small and large scale data security requirements.",Yes
QuantumEdge Networks,2019,53,Boston (USA),Network Performance,8,6,"Utilizes machine learning for network optimization, Subscription model with scalable pricing based on traffic volume, Addresses a critical need in network performance improvements","Highly competitive industry with significant players, Rapid advancements in technology may require continuous innovation, Potential challenges in differentiating service offerings","Telecommunications companies, large enterprises, and data centers requiring enhanced network performance.",Proprietary machine learning algorithms for effective network optimization and flexible subscription models tailored to customer needs.,No
VisionAI Corp,2021,33,San Francisco (USA),Computer Vision,8,7,"Automated quality inspection reduces need for manual labor, Scalable pricing model based on usage encourages adoption, Strong application in manufacturing and industrial sectors, Leverage AI and machine learning for continuous improvement","Dependence on high-quality data for accurate analyses, Potential competitive market with low barriers to entry, Reliability and accuracy must be maintained at scale, Cost-intensive to accumulate comprehensive datasets",Manufacturing and industrial sectors focusing on quality control processes,"Provides a cost-effective solution for quality inspection through a usage-based pricing model, reducing upfront costs and allowing for easy scalability.",No
DigitalTwin Solutions,2020,47,Chicago (USA),Industrial IoT,8,6,"Innovative technology leveraging IoT and digital twin for industrial applications, Subscription model providing recurring revenue stream, Custom implementation services allowing for tailored solutions and deeper customer relationships, Strong potential for integration with AI/ML for predictive analytics","High competition in the IoT space with large tech companies entering the market, Dependence on the adoption rate of digital twin technologies in industries which can vary, Implementation services may require significant resources, potentially impacting scalability, Data security and privacy concerns in IoT and digital twin applications","Manufacturing, energy, aerospace, and other industrial sectors seeking optimization and predictive maintenance solutions","Ability to offer highly customized digital twin solutions paired with IoT capabilities, potentially reducing operational costs and improving efficiency for industrial clients.",Yes
