Company Name,Founded Year,Total Employees,Headquarters,Industry,Growth Potential,Risk Level,Key Strengths,Concerns,Target Market,Competitive Advantage,Interesting
ViennaSystems International,2021,30,Vienna (Austria),Business Process Management,7,6,"Specialization in European workflow templates which may reduce entry barriers in European markets, Subscription model based on process complexity allows flexibility and scalability for different business sizes","Potential competition from larger global players in BPM, The European focus might limit market scale unless expanded",European businesses looking for tailored BPM solutions,Specialized European workflow templates that cater to regional compliance and business operations norms.,No
WarsawTech Solutions,2020,41,Warsaw (Poland),Enterprise Software,7,5,"Specialization in Eastern European markets, Focus on enterprise resource planning, Recurring revenue from annual maintenance fees","License model might limit scalability compared to cloud-based solutions, Potential language and regulatory barriers as they expand to new regions, Economic instability in some Eastern European markets could impact revenue",Eastern European enterprises seeking ERP solutions,Deep understanding of the Eastern European market and localization capabilities,No
ShanghaiCloud Technologies,2018,68,Shanghai (China),Cloud Infrastructure,8,5,"Focus on Asian enterprises, Consumption-based model, Efficient resource provisioning, Scalability of cloud services","Highly competitive market, Dependency on stable internet infrastructure, Regulatory challenges in various Asian markets",Asian enterprises requiring cloud management solutions,Specialized understanding of Asian market dynamics and needs,No
BrusselsData Group,2022,23,Brussels (Belgium),Data Governance,8,5,"Specialization in GDPR compliance, which remains a critical concern for companies handling personal data., Subscription model allows for predictable revenue streams and scalability., Focus on both data governance and compliance provides comprehensive solutions for clients.","Highly competitive market with numerous players focusing on data governance and privacy., Regulatory changes could impact the need for certain features or necessitate rapid adaptation., Dependence on European market could limit growth if expansion into other regions is not achieved effectively.","Medium to large enterprises handling significant volumes of personal data, particularly in Europe where GDPR compliance is mandatory.","Expertise in GDPR compliance and data governance combined into a single, scalable platform.",No
HelsinkiTech Innovations,2020,42,Helsinki (Finland),App Development,7,5,"Nordic design principles, Developer-based subscription model, Comprehensive app deployment options","Competitive app development market, High dependency on subscription retention, Need for continuous platform updates",Mobile app developers in Europe and globally who prioritize design and user experience,The combination of Nordic design principles with flexible app deployment offers a unique aesthetic and functionality focus uncommon in general app development platforms.,No
RomeTech Solutions,2019,50,Rome (Italy),Business Intelligence,8,5,"European market focus, Subscription-based revenue model, Comprehensive data sources, User-friendly dashboard","Competitive industry with strong existing players, Dependency on data quality and sources, Potential for market saturation",European companies seeking business intelligence solutions,Specialization in European market analytics with an emphasis on localized insights,No
DubaiSmart Systems,2021,34,Dubai (UAE),Smart Cities,8,6,"Focused on Middle Eastern urban centers, providing a regional advantage., Comprehensive smart city solutions including infrastructure, mobility, and security., Project-based implementation allows for high customization meeting local needs., Platform licensing provides recurring revenue streams.","Reliance on government contracts which can be unpredictable based on political climate., High competition from global smart city technology providers such as IBM, Cisco, and Siemens., Complexity and high cost of projects could impact cash flow.","Middle Eastern large urban areas, municipalities, and government entities.","Specialized understanding of Middle Eastern urban challenges and cultural context, coupled with a comprehensive platform that allows for tailored smart city solutions.",No
LisbonSoft Technologies,2020,45,Lisbon (Portugal),CRM,7,6,"Strong focus on European and LATAM markets, Multi-language support adapting to different regional needs, Subscription-based revenue model offering predictable income","Intense competition within the CRM industry from established players, Language barriers and cultural nuances in diverse markets, Dependency on subscription renewals for sustained revenues",Enterprise and medium-sized businesses looking to improve customer relationship management in the European and LATAM regions.,"LisbonSoft Technologies' competitive advantage lies in its tailored approach to multilingual markets across Europe and LATAM, paired with a subscription-based model allowing easy scalability and adaptation for diverse cultural needs.",No
BangkokTech Group,2018,61,Bangkok (Thailand),E-commerce,8,6,"Transaction fee model provides recurring revenue, Customizable storefronts cater to diverse business needs, Strategic geographic focus on emerging Southeast Asian markets, Strong understanding of local market dynamics","Highly competitive industry with major players like Shopee and Lazada, Dependence on internet infrastructure which varies across regions, Regulatory challenges in different Southeast Asian countries",Small to medium-sized businesses in Southeast Asia looking to establish or enhance their online presence.,"Strong regional focus with tailored solutions for diverse Southeast Asian markets, leveraging local insights and customizable features to meet varied business needs.",No
AthensData Solutions,2022,24,Athens (Greece),Data Analytics,7,5,"Focus on Mediterranean market insights, Subscription-based model providing recurring revenue, Scalable platform with user and dashboard-based pricing","Potential market size limitation due to regional focus, Highly competitive industry with larger players, Dependence on regional economic factors",Businesses in or targeting the Mediterranean region looking for localized data analytics and reporting tools.,"Customized insights and analytics for the Mediterranean market, offering value-added insights specific to the region.",No
PragueTech Systems,2020,43,Prague (Czech Republic),IT Management,7,5,"Geographic focus on the growing Central European market, Agent-based subscription model ensures recurring revenue, Comprehensive IT infrastructure management solution, Strong monitoring features","Potential competitive pressure from larger global IT providers, Dependence on regional economic conditions, Market saturation risks within Central Europe",Small to medium-sized businesses in Central Europe,"Deep understanding and specialization in Central European IT infrastructure needs, coupled with a recurring subscription-based revenue model.",No
JohannesburgSoft Solutions,2019,52,Johannesburg (South Africa),Enterprise Software,8,6,"Focus on African markets provides niche advantage, Licensing model allows for predictable revenue streams, Implementation services enhance customer engagement and retention, Potential for market leadership in a growing industry within Africa","High dependency on economic and political stability in African countries, Challenges in scaling implementation services, Potential competitive pressure from global enterprise software giants entering the African market, Need for constant updates and innovations to keep pace with technology trends",Businesses and enterprises in African markets,Specialization in African markets with a comprehensive understanding of regional needs and challenges.,No
BudapestAI Technologies,2021,32,Budapest (Hungary),Natural Language Processing,8,6,"Focus on Central European languages, which are underserved in AI., API-based model allows easy integration and scalability., Subscription model provides predictable revenue stream., Expertise in niche language processing, potentially leveraging advanced NLP models tailored to specific languages.","Potential market size may be limited compared to global NLP solutions., High competition from global giants in NLP such as Google, Microsoft, and OpenAI that may expand their offerings to these languages., Dependence on continual technological advancements and model accuracy., Possible regulatory and data privacy issues in handling language data across different Central European countries.","Businesses operating in Central Europe requiring NLP capabilities, including local tech startups, multinational companies seeking to localize services, and governmental institutions.","Specialization in Central European languages, addressing a specific regional need that is often overlooked by global NLP providers.",No
SydneyHealth Systems,2020,47,Sydney (Australia),Healthcare IT,8,5,"Region-specific expertise in APAC market, Scalable pricing model with subscription-based tiering, Possibility for large customer base with hospital and clinic networks, Focus on healthcare management which is a growing necessity","Highly competitive market with well-established competitors, Dependency on regulatory changes and healthcare reforms, Challenges in acquiring large institutional clients due to integration complexities","Healthcare providers in the APAC region including hospitals, clinics, and private practices.","Specialization in the APAC region, offering local market adaptation and compliance with regional healthcare regulations.",No
MilanTech Solutions,2018,63,Milan (Italy),Retail Software,8,6,"Subscription-based revenue model, Scalable according to retail location and transaction volume, Focus on fashion and retail, a large industry","Highly competitive space with many established players, Depends on retail environment, sensitive to economic downturns, Continuous need for platform updates to keep up with fashion trends","Retail businesses focused on fashion, ranging from small boutiques to large chains that require comprehensive management software solutions.","Specialized expertise in fashion and retail sectors with a scalable SaaS model, allowing businesses to adjust their subscription based on real-time needs, improving cost efficiency and resource allocation.",No
MoscowData Corp,2022,25,Moscow (Russia),Big Data,8,6,"Localized analytics tailored to regional needs, Scalable subscription model based on nodes and data volume, Potential for integration with various sectors needing big data solutions, Strong focus on processing efficiency","High competition from established global players like AWS, Google Cloud, and Microsoft Azure, Data privacy and regulatory challenges, especially in international markets, Dependence on the growth of big data usage for continued expansion",Enterprise clients needing localized big data analytics solutions,Scalable and customizable analytics platform specializing in localized data processing.,No
IstanbulTech Group,2020,44,Istanbul (Turkey),Enterprise Software,7,6,"Strong understanding of regional markets, Specialized solutions for Middle Eastern and Mediterranean areas, Combines software with implementation services","Limited geographical focus may restrict scale, Dependence on license-based revenue model could be impacted by shift towards SaaS, Potential geopolitical risks in target markets","Middle Eastern and Mediterranean regions, focusing on enterprises needing tailored software solutions.","Deep regional expertise and tailored solutions, coupled with implementation services for complex markets.",No
BuenosAires Systems,2019,53,Buenos Aires (Argentina),Business Management,8,4,"Strong focus on LATAM market with cultural and market-specific adaptations, Flexible pricing model based on company size and chosen modules, Comprehensive business management features","High competition from global and local players in the business management platform space, Economic fluctuations in LATAM can impact subscription models, Dependency on internet infrastructure in LATAM",Mid to large-sized enterprises in the Latin American market,Tailored business management solutions with a flexible pricing structure specifically designed for the unique needs of LATAM enterprises.,No
AucklandTech Solutions,2021,31,Auckland (New Zealand),Cloud Solutions,8,5,"Local data residency which is crucial for data compliance in Oceania, Subscription model promotes scalability and predictable revenue streams, Tailored cloud solutions for the specific needs of the Oceania market","Potential limitations in scalability beyond the Oceania region, Strong competition from established global cloud providers, Economic and regulatory risks specific to the Oceania region",Businesses and governmental organizations in the Oceania region seeking compliant and efficient cloud solutions.,"AucklandTech Solutions' competitive advantage is its focus on local data residency and compliance in the Oceania region, creating a tailored service that meets regional requirements better than global competitors.",No
StockholmFintech Innovations,2020,46,Stockholm (Sweden),Fintech,8,5,"Focus on Nordic markets providing localized solutions, Combination of payment processing and financial compliance, Recurring revenue model with transaction fees and subscriptions, Growing demand for digital payment solutions in the Nordic region","Market competition from established players and new entrants, Regulatory changes affecting financial compliance, Dependence on economic stability of Nordic countries",Nordic businesses requiring payment processing and compliance solutions,Localized expertise in financial compliance and payment solutions tailored for Nordic markets,No
RiyadhTech Group,2018,59,Riyadh (Saudi Arabia),Enterprise Software,7,6,"Specialization in Middle Eastern market, Established presence with perpetual licensing model, Experienced in ERP solutions","Perpetual licensing might limit recurring revenue opportunities, High competition from global ERP providers, Economic and political risks in the Middle Eastern region",Middle Eastern businesses seeking ERP solutions,Cultural and market expertise tailored to Middle Eastern businesses,No
LjubljanaTech Systems,2022,22,Ljubljana (Slovenia),Localization,7,4,"Subscription-based revenue model ensures steady and predictable income, Offers scalability to various customer needs through language pairs and content volume options, Caters to a growing demand for digital globalization of products and services","Highly competitive industry with big players like SDL, Lionbridge, and Smartling, Potential cultural and linguistic complexities in expanding into diverse global markets, Dependence on technology partnerships for integration into client ecosystems","Businesses seeking to localize their digital content for global markets, including software developers, e-commerce companies, and multinational corporations","Flexibility in pricing and scalability, allowing clients to choose services based on their specific language and content needs",No
DelhiSoft Technologies,2020,48,New Delhi (India),IT Services,4,3,"Proprietary management tools enhance service delivery efficiency, Customized software development caters to specific client needs, Time-based billing model ensures scalable revenue streams","Dependence on customized software projects could limit scalability, Competition from larger IT service providers with more resources",Medium to large enterprises seeking customized IT solutions,Combination of proprietary management tools and custom software development expertise positions DelhiSoft Technologies as a unique solution provider for personalized IT needs.,No
AmsterdamLogistics Solutions,2019,55,Amsterdam (Netherlands),Supply Chain,8,5,"Subscription-based revenue model ensures predictable cash flow., Specialization in European logistics allows for tailored solutions for the regional market., Ability to adapt pricing based on shipment volume and transportation modes offers flexibility to customers.","Highly competitive market with major players like DHL, UPS, SAP, etc., Regulatory challenges associated with cross-border logistics in the EU could impact operations., Dependency on economic conditions as shipment volumes can fluctuate.","Logistics companies and supply chain managers operating within Europe, specifically those looking for optimized shipment volume and transport mode solutions.",Focused expertise in European logistics with adaptive pricing models based on specific shipment metrics grants them regional operational efficiency compared to generalized solutions.,No
TaipeiTech Innovations,2021,33,Taipei (Taiwan),Hardware Manufacturing,7,6,"Unique transaction fee model enhances revenue, Subscription-based inventory monitoring creates recurring revenue, Strong market need for efficient hardware procurement solutions","Highly competitive market with many players, Dependency on technology adoption by traditional manufacturers, Potential vulnerability to economic downturns affecting hardware manufacturing sector",Hardware manufacturers and distributors seeking efficient component management and procurement solutions.,Integrated procurement and inventory management platform reduces operational costs and increases efficiency for hardware manufacturers.,No
OsloData Systems,2020,42,Oslo (Norway),Data Analytics,7,6,"Specialization in Nordic markets creates a competitive niche, Offers user-based subscription model that provides predictable revenue streams, In-depth visualization tools enhance user experience and decision-making, Localized data analytics platform may lead to higher market penetration in targeted regions","Limited geographical focus may hinder global scalability, Facing competition from globally recognized data analytics firms like Tableau, Power BI, Need for continuous innovation to keep up with evolving data analytics trends, Dependency on economic stability in Nordic markets",Nordic enterprise and mid-sized businesses seeking specialized data analytics solutions,"OsloData Systems' specialization in the Nordic market provides it with tailored insights and solutions that align closely with regional data needs and compliance, giving them an edge over generalist data analytics platforms.",No
ViennaHealth Technologies,2018,60,Vienna (Austria),Healthcare IT,80,60,"European privacy compliance, Provider-based licensing model, Comprehensive patient record modules, Specialized focus on healthcare management","Regulatory risks in healthcare industry, High competition from established players, Need for constant updates to comply with privacy laws",European healthcare providers and hospitals,Strong focus on European privacy regulations and provider-centric licensing model,No
MontrealTech Solutions,2022,26,Doha (Qatar),Smart Buildings,8,7,"Specialization in Middle Eastern climate optimization, Integration of smart building management solutions, Subscription-based model allows for recurring revenue","Potential competition from local Middle Eastern companies, Market penetration challenges outside the initial geography, Dependency on local infrastructure and regulations",Building owners and property developers in Middle Eastern regions,"Expertise in climate optimization specifically for Middle Eastern environments, offering tailored sensor-integrated solutions.",No
KievSoft Systems,2020,40,Kiev (Ukraine),Software Development,7,5,"Strong focus on automation and efficiency, Integration with existing developer tools and repositories, Scalable business model through per-developer licensing","Highly competitive industry with numerous established players, Dependence on continuous innovation to maintain competitive edge, Potential integration challenges with various repository systems",Software development teams and enterprises focusing on continuous integration and delivery,Niche focus on testing automation with seamless repository integration and a per-developer pricing model that scales with organization size,No
DataFlow Technologies,2020,43,San Francisco (USA),Data Integration,8,4,"Real-time data transformation capabilities, Flexible pricing model based on data volume and connectors, Strong focus on automation","Potential high competition from established players in the data integration space, Scalability challenges with increasing data volumes","Businesses with high data integration needs, including sectors like finance, healthcare, and retail","Automated, real-time data processing and transformation tailored to customer needs with a flexible pricing model.",Yes
GlobalTech Solutions,2019,56,Berlin (Germany),Enterprise Software,8,6,"Multi-language support enhancing global reach, License-based model ensures steady revenue streams, Comprehensive implementation services add value, Strong market presence in international business software","Dependency on enterprise customers may limit flexibility, High dependence on license renewal, Implementation complexity may affect customer satisfaction",International businesses requiring multilingual enterprise software solutions,"Ability to offer a robust, multi-language enterprise software with specialized implementation services tailored for international businesses.",No
CloudMatrix Systems,2021,35,Boston (USA),Cloud Management,8,5,"Cost optimization features that appeal to cloud-based businesses looking to maximize efficiency., Innovative pricing model based on percentage-of-savings, aligning vendor success with client cost savings., Subscription model provides a regular revenue stream, increasing financial predictability.","Highly competitive industry with major players like AWS, Azure, and Google offering native management tools., Dependence on fluctuating cloud spend by businesses could lead to unpredictable revenue streams., Challenges in maintaining data security and privacy for multi-cloud environments.","Businesses utilizing multiple cloud services, particularly those looking to optimize and reduce cloud infrastructure costs.",The percentage-of-savings fee structure incentivizes proactive cost savings and aligns CloudMatrix's success with its clients' financial performance.,Yes
SingaporeSaaS Group,2020,45,Singapore,CRM,7,4,"Regional compliance expertise, Tailored CRM solutions for APAC markets, Per-user subscription model provides scalable revenue, Strong focus on customer service and support in local markets","High competition in the CRM space from global players, Dependence on APAC market which could limit global expansion, Potential for local economic downturns affecting subscription rates",Small to medium-sized businesses in the APAC region looking for CRM solutions that adhere to regional compliance standards.,"Specialization in regional compliance and a focus on APAC markets provides a tailored experience that global competitors might not offer, ensuring better integration with local business practices.",No
SecureTech Innovations,2022,26,Toronto (Canada),Cybersecurity,8,3,"Zero trust network security is increasingly becoming a standard in cybersecurity, especially useful for companies dealing with sensitive data., The business model of per-user subscription provides a predictable revenue stream and scalability., The inclusion of identity verification and endpoint protection creates a comprehensive security solution appealing to enterprise clients., Growing demand for cybersecurity solutions as digital transformation accelerates across industries.","Competitive landscape is intense with major players like Cisco, Palo Alto Networks, and IBM that might overshadow the company's offerings., Constant evolution in cyber threats requires ongoing innovation and updates, which could strain resources., Projecting the correct user subscription fees to remain competitive while ensuring profitability may pose challenges.",Medium to large enterprises requiring enhanced security measures to protect sensitive data and communication networks.,"SecureTech Innovations offers a holistic approach to zero trust security by integrating identity verification and endpoint protection, which potentially offers better security outcomes compared to vendors focusing on only one aspect.",Yes
TechVision Systems,2019,52,London (UK),Computer Vision,8,5,"Strong alignment with the growing demand for retail analytics, Innovative subscription model based on camera count and processing minutes, Potential for horizontal and vertical market expansion","High competition in the computer vision space, Dependence on continued advancements in AI technology, Price sensitivity in the retail sector could limit margins",Retail businesses seeking enhanced analytical capabilities through computer vision technologies,Subscription model flexibility combined with advanced computer vision analytics tailored for the retail sector,No
RapidDev Labs,2020,48,Austin (USA),Low-Code Platform,8,5,"Strong focus on enterprise integrations, making it suitable for large organizations., Subscription-based model provides recurring revenue streams., Low-code platform, catering to increasing demand for rapid application development.","Highly competitive market with well-established competitors., Dependency on continuously updating integrations with enterprise software., Market confusion or resistance from traditional development teams.",Large enterprises and mid-sized businesses seeking rapid application development solutions.,"Deep enterprise integration capabilities that facilitate seamless connections with existing enterprise systems, reducing development time and resources.",Yes
