Company Name,Founded Year,Total Employees,Headquarters,Industry,Growth Potential,Risk Level,Key Strengths,Concerns,Target Market,Competitive Advantage,Interesting
QuantumEdge Systems,2020,39,Seattle (USA),Edge Computing,8,6,"AI-powered analytics enabling real-time processing, Subscription model offers predictable recurring revenue, Positioned in a rapidly growing industry with increasing demand for real-time data processing, Scalable platform that can adapt to various industries and use cases","High competition from large tech companies in edge computing and AI, Dependency on continuous innovation to maintain technological edge, Potential challenges in managing data security and privacy concerns in real-time analytics","Enterprises and industries looking to optimize data processing at scale, such as retail, healthcare, and industrial IoT.",Combines AI with edge computing to provide superior real-time analytics capabilities that reduce latency and improve efficiency for processing data at the edge.,Yes
MetaConnect Solutions,2021,28,Boston (USA),Collaboration,8,6,"Innovative immersive collaboration features, High demand for virtual meeting solutions, Scalable subscription model","High competition in collaboration industry, Dependency on technology adoption trends, Potential hardware compatibility issues",Businesses seeking advanced virtual collaboration tools,Unique immersive meeting experiences differentiation,Yes
NanoSecure Technologies,2019,53,Washington DC (USA),Cybersecurity,8,6,"Innovative zero-day threat protection, Behavioral analysis engine, Endpoint-based licensing model, Centralized management console for ease of use","High level of competition in cybersecurity industry, Need for continuous updates due to evolving threats, Potential for high R&D costs",Large enterprises and governmental organizations with high-security needs,Advanced behavioral analysis engine provides superior protection against unknown threats.,No
CloudFleet Systems,2022,22,San Francisco (USA),Fleet Management,8,6,"Scalable subscription-based model, Integration with IoT hardware, Strong data analytics capabilities, Focus on vehicle telematics","Highly competitive market with large players, Reliance on IoT hardware which may involve supply chain risks, Potential cybersecurity risks","Logistics, transportation companies, and any businesses with sizable vehicle fleets",Combines fleet management with advanced telematics and IoT capabilities to provide comprehensive data insights.,Yes
DataSense Analytics,2020,46,Austin (USA),Customer Data,8,5,"Unified customer profiles, Advanced segmentation tools, Subscription-based revenue model, Scalability with API calls, High demand for customer data platforms","Market competition from established players, Dependence on third-party data sources, Privacy and data compliance regulations",Medium to large enterprises seeking enhanced customer data integration and insights.,"Offers a unified platform that combines profile unification with segmentation tools, allowing for more personalized customer interactions.",Yes
TechGrowth Solutions,2018,67,Chicago (USA),Sales,8,6,"Per-user pricing model allowing for scalable growth, Dual revenue streams from software licensing and onboarding services, Aligned with the increasing digital transformation trend in sales","Highly competitive sales enablement software market, Dependence on continuous innovation to stay ahead, Potential customer churn if not constantly providing value",Mid-to-large enterprises seeking to optimize their sales and revenue processes,Comprehensive software solution with integrated support services leading to faster implementation and greater initial user adoption.,No
SmartRetail Systems,2021,35,Minneapolis (USA),Retail Analytics,8,4,"Subscription-based model ensures recurring revenue streams., Focus on customer journey tracking which is becoming increasingly important for retailers looking to enhance customer experience., Scalable platform adaptable to different store sizes and features.","Highly competitive industry with potential for rapid changes in technology., Dependence on retail industry health, which is susceptible to economic fluctuations., Data privacy concerns around tracking and analysis of customer journeys.",Retail businesses ranging from single-store operations to large chains looking to optimize their in-store traffic and improve customer experiences.,SmartRetail Systems stands out with its specialized focus on the customer journey analytics and its flexible subscription model tailored to different store sizes and operational needs.,Yes
VirtualOffice Technologies,2020,41,Toronto (Canada),Remote Work,8,5,"Established market need for remote work solutions, Scalable subscription-based business model, Focus on team collaboration features could differentiate in the remote work space, Potential for integration with other software platforms","High competition from established players like Zoom, Microsoft Teams, and Slack, Dependence on continuous innovation to retain market relevance, Subscription fatigue among users due to market saturation with similar tools",Small to large businesses looking for integrated remote work solutions,Focus on enhanced collaboration features tailored for diverse team environments,Yes
BlockData Solutions,2022,24,Vancouver (Canada),Blockchain Analytics,8,7,"Scalable subscription model, API access for integration with other systems, Strong demand for blockchain analytics as industry grows","High competition in blockchain analytics, Rapid technology changes associated with blockchain, Regulatory uncertainties in blockchain ecosystem","Financial institutions, cryptocurrency exchanges, blockchain enterprises, government agencies seeking blockchain data insights.",Providing comprehensive blockchain indexing and analytics with flexible tier-based pricing and robust API integration capabilities.,No
AgileHealth Systems,2019,58,Boston (USA),Healthcare IT,7,4,"Telehealth integration, Per-provider subscription model, Patient engagement features, Scalable healthcare IT solutions","Regulatory compliance challenges, High competition in the healthcare IT sector, Potential integration issues with existing systems","Healthcare providers, including hospitals, clinics, and individual practitioners",Unique combination of telehealth capabilities with patient engagement in a subscription model,No
DataControl Technologies,2021,31,New York (USA),Data Governance,8,4,"Specialized platform for data governance and quality management, Scalable subscription model based on data sources, Ability to handle complex data quality rules, Increased demand for data governance solutions due to regulatory pressures","High competition from established players and other technology startups, Dependency on evolving data compliance regulations, Ensuring customer data security and privacy, Need for continuous innovation to remain relevant","Large enterprises and mid-sized companies dealing with high volumes of data across various sectors such as finance, healthcare, and retail.","Customizable platform that addresses specific data governance challenges, coupled with a flexible subscription model that caters to varying data complexity and source requirements.",Yes
CloudGuardian Security,2020,44,Denver (USA),Cloud Security,8,5,"Compliance automation reduces manual oversight and errors, Node-based subscription aligns costs with cloud usage, Strong focus on security controls, critical for cloud environments","Highly competitive industry with rapidly evolving threats, Dependence on cloud service popularity and expansion, Potential regulatory changes affecting cloud security standards",Medium to large enterprises utilizing cloud services needing robust security measures,"Automated compliance and node-based subscription model offer scalable, cost-effective solutions for businesses adopting cloud technologies.",Yes
IntelliSales Corp,2019,57,San Diego (USA),Sales Intelligence,8,6,"AI-powered platform enabling efficient sales forecasting and intelligence, Comprehensive CRM integrations enhancing user experience, Subscription model supporting scalable revenue streams, Focus on data-driven insights that enhance decision-making for sales teams","High competition in the sales intelligence market, Dependency on the accuracy and reliability of AI algorithms, Integration complexity with various CRM platforms could impact adoption","Businesses seeking enhanced sales and forecasting intelligence, specifically sales teams within organizations that rely on robust CRM systems.",IntelliSales Corp's AI-driven approach combined with seamless CRM integrations offers a significant edge in providing actionable sales insights that can lead to better-informed decision-making.,No
FlexAPI Networks,2022,25,Seattle (USA),API Management,8,6,"Comprehensive API management platform, Developer-friendly with dedicated portal, Advanced analytics for API usage, Scalable pricing model based on API calls and endpoints","Competitive market with many established players, Possible pressure on margins due to pricing competition, Technical debt as platform scales, Need for continuous innovation to stay ahead","Developers, businesses utilizing APIs, SaaS companies, tech enterprises",Integrated analytics and developer portal providing deep insights and enhanced developer experience,Yes
MobileSync Technologies,2020,42,Chicago (USA),Mobile Software,7,6,"Cross-platform capability ensures broader market reach, Subscription model offers potential for recurring revenue, Addresses increasing need for data synchronization in mobile-first environments","Highly competitive industry with major players like Google and Microsoft, Dependency on platform compatibility and OS updates, Security challenges regarding data synchronization across platforms",Businesses and developers requiring seamless data sync between mobile platforms for apps and enterprise solutions,Specialized focus on cross-platform synchronization sets it apart from solutions tied to specific ecosystems.,Yes
SmartProcess Solutions,2018,65,Washington DC (USA),Process Automation,8,5,"Visual process designer allows for ease of use and accessibility., Scalable subscription model based on complexity and volume promotes wide customer adoption., The process automation industry is growing rapidly with increased demand for efficiency.","Highly competitive market with established players., Dependency on continuous updates to remain relevant in changing tech landscapes.","Businesses seeking to automate and optimize their processes, especially SMEs looking for scalable solutions.",Flexible subscription model combined with an intuitive visual interface for process design.,No
DataClarity Systems,2021,33,Toronto (Canada),Business Intelligence,7,4,"User-friendly interface for creating visualizations, Scalable subscription model appealing to SMEs, Strong focus on visual data representation enhancing decision-making","Highly competitive market with major players like Tableau and Power BI, Dashboard limits may deter larger organizations, Dependence on continuous feature innovation to stay relevant",Small to Medium Enterprises (SMEs) looking for cost-effective data visualization solutions,Targeting cost-conscious SMEs with a user-based subscription and intuitive platform.,Yes
CloudManage Solutions,2020,45,Austin (USA),Cloud Management,8,6,"Unique pricing model with percentage of savings incentivizes client success, Platform supports multiple cloud environments, increasing addressable market, Focus on cost optimization is highly relevant as companies look to cut cloud expenses","Highly competitive market with major players like AWS, Google, and Microsoft, Dependency on cloud service providers for integration and functionality updates, Pricing model could limit revenue if not properly managed",Businesses utilizing multi-cloud environments seeking cost optimization solutions,Percentage of savings pricing model aligns incentives with customer success and provides measurable value.,Yes
SupplyVision Technologies,2019,51,San Francisco (USA),Supply Chain,8,5,"Subscription-based revenue model offers predictable and recurring revenue streams., Increasing demand for supply chain visibility and analytics post-pandemic., Ability to scale with suppliers and transaction volume enhances long-term customer retention.","High competition from other supply chain analytics platforms., Dependence on continued technological advancement and innovation to stay ahead., Potential challenges in integrating deeply with existing enterprise systems of large clients.",Mid to large-sized enterprises seeking enhanced supply chain visibility and efficiency.,Focus on predictive analytics capabilities combined with scalable subscription model tailored to clients' transaction volume and supplier relationships.,No
AgroTech Solutions,2022,26,Minneapolis (USA),Agriculture,8,6,"Integration of IoT sensors increases data accuracy and insights for farmers., Field-based subscriptions offer a scalable business model with predictable revenue streams., Potential to improve crop yields and reduce resource wastage through precise monitoring and analytics.","Dependence on hardware components can lead to higher costs and operational challenges., Reliance on consistent internet connectivity in rural areas may pose a challenge., Adoption rate may be slow among traditional farmers who are resistant to technological changes.",Farmers and agricultural businesses seeking efficiency through technology-enhanced farming practices.,"The integration of IoT sensor technology into a precision agriculture platform provides real-time data analytics, offering an edge in resource management and crop optimization.",Yes
SecureComm Networks,2020,43,Boston (USA),Communications,7,5,"Strong focus on security and encryption, Per-user subscription model promoting steady revenue, Potential to expand into different sectors within enterprise communication","Highly competitive market with established players, Potential regulatory challenges surrounding data privacy, Dependency on enterprise adoption rates",Large and medium-sized enterprises needing secure communication solutions,Unique encryption features tailored for enterprise-level security needs,Yes
LogicBrain Systems,2019,55,Seattle (USA),Decision Intelligence,8,6,"AI-powered recommendations enhance decision-making processes, Subscription-based model allows for predictable revenue streams, Scalable platform accommodates varying decision complexity and volume","High competition in AI and decision intelligence spaces, Dependency on advancements in AI technology, Complexity in calculating subscription pricing based on decision factors",Large enterprises and medium-sized businesses that require advanced decision-making support,Ability to tailor AI recommendations to specific organizational decision-making processes based on complexity and volume,No
EdgeCompute Technologies,2021,32,Denver (USA),Edge Computing,7,6,"Specializes in edge computing, a rapidly growing segment of the IT infrastructure market., Node-based pricing with bandwidth tiers offers flexible and scalable pricing models for diverse customer needs., Focus on latency-sensitive applications positions it well in industries requiring real-time data processing.","High competition from established cloud providers offering edge solutions, like AWS, Microsoft Azure, and Google Cloud., The company's reliance on cutting-edge technology requires continuous innovation and significant R&D investment, which can strain resources., Potential challenges in achieving widespread deployment and integration with existing systems.","Industries requiring real-time data processing and low latency, such as IoT, autonomous vehicles, manufacturing, and telecommunication sectors.","EdgeCompute Technologies offers specialized infrastructure tailored for latency-sensitive applications, potentially providing lower latency and more efficient data processing compared to traditional centralized cloud solutions.",No
SmartEnergy Solutions,2020,48,Chicago (USA),Energy Management,8,4,"Subscription-based revenue model ensures recurring income and potential scalability., Focus on the growing smart building sector aligns with increasing demand for energy-efficient solutions., Platform optimizes energy usage, leading to cost savings and sustainability, which are high-priority areas for many businesses.","Potential competition from established energy management firms and emerging startups., Dependence on regulatory changes and incentives related to energy efficiency which might affect market dynamics., Adoption barrier in older buildings lacking necessary infrastructure for full platform deployment.",Building owners and facility managers of commercial buildings looking to optimize energy usage and reduce costs.,"SmartEnergy Solutions offers a tailored, scalable subscription model based on real need metrics like square footage and metering points, enhancing accessibility for various sizes of smart buildings.",Yes
CloudArchive Systems,2018,62,New York (USA),Data Archiving,8,5,"Scalable subscription model, Focus on compliance management, Strong industry demand due to regulatory requirements, High customer retention potential due to long-term archiving needs","High competition in the data archiving space, Dependent on data privacy regulations and laws, Requires robust cybersecurity measures","Large enterprises in regulated industries such as finance, healthcare, and legal sectors.","CloudArchive Systems' competitive advantage lies in its specialized compliance management features tailored to meet stringent regulatory requirements, distinguishing it from general data storage providers.",No
BioTech Platforms,2022,24,San Diego (USA),Life Sciences,8,6,"Subscription-based revenue model providing predictability, Focus on data management for life sciences, a growing sector, Capable of scaling with user growth and data volume","Potential competition from established data management solutions, Reliance on life sciences industry trends and growth, Data security and compliance challenges in the life sciences sector",Life sciences companies and research institutions,"Specialized platform tailored for the life sciences sector with a subscription model based on users and data volume, allowing scalability and customization for user needs.",Yes
RealEstateAnalytics,2020,40,Austin (USA),Real Estate,8,6,"Predictive analytics for real estate valuations, Subscription-based revenue model, Potential scalability across multiple markets","Dependence on data accuracy and availability, Competitive market with existing large players, Regulatory challenges in different real estate markets","Real estate investors, property managers, and financial institutions",Advanced predictive valuation models that provide unique insights and a scalable subscription model based on properties analyzed,Yes
CloudIdentity Solutions,2019,53,Washington DC (USA),Identity Management,8,4,"Passwordless authentication reduces friction for users, Offers scalable user-based subscription model, Focus on security in identity and access management markets","Highly competitive identity management industry, Dependence on user-based revenue model could increase churn risk",Businesses and organizations seeking robust identity and access management solutions with enhanced security features,Enables seamless user experience through passwordless authentication and flexible subscription tiers,No
AI Operations Group,2021,30,Seattle (USA),IT Operations,8,5,"Anomaly detection capabilities improve IT efficiency, Agent-based pricing offers flexibility, Incident resolution automates IT operations, Focus on IT operations, a sector in continuous demand","Potential competition from established IT operations platforms, Reliance on AI could face challenges with data security and privacy concerns, Emerging market with evolving regulatory compliance issues",Medium to large enterprises with complex IT infrastructure,Specialized focus on anomaly detection and incident resolution using AI provides a differentiated offering in the IT operations industry.,Yes
QuantumSecurity Technologies,2020,47,Toronto (Canada),Cybersecurity,85,70,"Focus on quantum-resistant encryption solutions positions the company as an innovator in the field, providing future-proof security measures., License-based model can lead to recurring revenue streams and long-term client relationships., Implementation services offer additional value to clients, potentially leading to higher customer satisfaction and retention.","Quantum-resistant encryption is still a developing market, and the company may face uncertainties in technology adoption and market size., High risk due to potential competition from larger cybersecurity firms with more resources., Dependence on government regulations and compliance standards, which can vary and impact product adoption.",Large enterprises and governmental organizations that require high-security standards and may be vulnerable to future quantum computing threats.,Proprietary quantum-resistant encryption technologies and a comprehensive solution package including both encryption and key management.,No
SmartTeam Solutions,2018,68,Boston (USA),Collaboration,8,6,"Scalable subscription model, Wide array of collaboration tools, User-friendly interface, Potential for integrations with other popular business applications","Highly competitive market with established players, Dependence on keeping platform technology updated, User churn due to better offerings from competitors",Small to Medium Enterprises (SMEs) and remote teams looking for effective collaboration and project management solutions.,"Comprehensive project and task management features with a focus on enhancing team collaboration, catering specifically to SMEs.",No
CloudFactory Technologies,2022,25,San Francisco (USA),Manufacturing,8,6,"Digital twin capabilities enhance operational insights, Subscription model provides recurring revenue, Connected device tiers allow for scalability and customization","Dependency on advanced manufacturing sectors that adopt digital solutions, Potential high cost of implementation for clients, Security concerns regarding connectivity and data transmission",Manufacturers looking to optimize operations with digital solutions and manage factories using IoT and connected devices.,"Combining digital twin technology with a subscription model allows for continuous operational management and optimization, appealing to manufacturers aiming for efficiency and adaptability.",No
IntelliDoc Systems,2020,44,Chicago (USA),Document Management,7,5,"Scalable, subscription-based revenue model, Advanced automated document processing capabilities, Appeals to a wide range of industries requiring efficient document management","High competition in the document management sector, Reliance on continually improving AI/ML features to stay competitive",Businesses of all sizes across various industries that require efficient document management solutions.,"Intelligent processing technology combined with flexible subscription model, which allows for customization based on document volume and unique processing rules.",Yes
MarketAnalytics Corp,2019,56,New York (USA),Market Intelligence,7,5,"Comprehensive market intelligence tools, Subscription-based model provides recurring revenue, Strong competitive analysis features","Highly competitive market with numerous similar offerings, Dependence on continuous data acquisition and updates, Potential data privacy and compliance issues",B2B companies seeking market intelligence and competitive analysis capabilities,Ability to offer detailed competitive analysis with customizable subscription models based on tracked competitors and update frequency.,No
TechTraining Solutions,2021,33,Denver (USA),EdTech,7,5,"Offers specialized technical skills assessment alongside learning management., Per-user subscription model can enhance recurring revenue streams., Comprehensive course library caters to a wide range of technical training needs.","Highly competitive EdTech market with numerous established players., Dependence on continuous content updates to stay relevant., Market saturation challenges and differentiation pressures.",Corporations and educational institutions seeking to enhance their technical training programs.,Integration of skills assessment with learning management system allows for tailored employee training and precise measurement of skill advancement.,Yes
CloudMonitor Technologies,2020,46,Minneapolis (USA),IT Monitoring,7,4,"Scalable node-based pricing model, Flexible retention period options, Comprehensive observability features","Highly competitive market with established players, Dependency on infrastructure trends, Pricing pressure from competitors",Large enterprises and mid-sized companies with complex IT infrastructures,Flexible pricing model that scales with customer needs and diverse observability features.,Yes
RetailFlow Systems,2018,64,Seattle (USA),Retail Software,8,5,"Comprehensive inventory management, Scalable pricing model, Focus on retail sector specifics","Market competition from larger tech giants, Dependency on subscription retention, Need for continuous technological updates",Mid to large-sized retail businesses,Store-based subscription model with transaction volume tiers allowing scalability for retailers,No
